{
 "batch": [
  {
   "evidence": [
    {
     "entity": "automation.brain_test_dead_ref",
     "value": "Missing: light.brain_test_missing. It cannot work as written.",
     "when": 1799999700.0
    }
   ],
   "hot": false,
   "kind": "check",
   "protected": false,
   "repeats": 1,
   "safety": false,
   "salience": 0.509,
   "seen_at": 1800000000.0,
   "source": "check:auto.dead_ref",
   "subject": "automation.brain_test_dead_ref",
   "text": "Automations naming missing entities [serious]: Automation 'brain_test_dead_ref' refers to entities that do not exist"
  },
  {
   "evidence": [
    {
     "entity": "automation.brain_test_dead_service",
     "value": "Not registered: notify.brain_test_nowhere. The action fails every time it runs.",
     "when": 1799999699.0
    }
   ],
   "hot": false,
   "kind": "check",
   "protected": false,
   "repeats": 1,
   "safety": false,
   "salience": 0.509,
   "seen_at": 1800000000.0,
   "source": "check:auto.dead_service",
   "subject": "automation.brain_test_dead_service",
   "text": "Automations calling missing services [serious]: Automation 'brain_test_dead_service' calls a service that no longer exists"
  },
  {
   "evidence": [
    {
     "entity": "binary_sensor.kitchen_leak",
     "value": "on",
     "when": 1800000000.0
    }
   ],
   "hot": true,
   "kind": "state",
   "protected": false,
   "repeats": 1,
   "safety": true,
   "salience": 0.92,
   "seen_at": 1800000000.0,
   "source": "eventbus",
   "subject": "binary_sensor.kitchen_leak",
   "text": "Kitchen leak off → on"
  },
  {
   "evidence": [
    {
     "entity": "lock.front_door",
     "value": "unlocked",
     "when": 1800000000.0
    }
   ],
   "hot": true,
   "kind": "state",
   "protected": true,
   "repeats": 1,
   "safety": false,
   "salience": 0.4,
   "seen_at": 1800000000.0,
   "source": "eventbus",
   "subject": "lock.front_door",
   "text": "Front door locked → unlocked"
  },
  {
   "evidence": [],
   "hot": false,
   "kind": "time",
   "protected": false,
   "repeats": 1,
   "safety": false,
   "salience": 0.15,
   "seen_at": 1800000000.0,
   "source": "schedule",
   "subject": "the evening pass",
   "text": "the bedtime checks pass ran"
  }
 ],
 "captured_at": 1800000000,
 "id": "first-look-rehearsal",
 "inputs": {},
 "kind": "first_look",
 "labels": [
  {
   "floor": "watch",
   "signal": 1,
   "why": "a defect planted on purpose; ignoring it is the wrong call"
  },
  {
   "floor": "watch",
   "signal": 2,
   "why": "a defect planted on purpose; ignoring it is the wrong call"
  },
  {
   "floor": "act",
   "guard": true,
   "signal": 3,
   "why": "a tripped leak sensor; no reply may lower it"
  },
  {
   "floor": "investigate",
   "guard": true,
   "signal": 4,
   "why": "a protected entity moving; never ignored"
  }
 ],
 "note": "The rehearsal's planted defects as the signals a checks pass would offer the Resident, plus a tripped leak sensor and a protected lock unlocking. The leak and the lock are guard labels — floors the code enforces after any reply — and the free replay proves they hold against a model that ignores everything. The planted rows are graded only when a real model is asked.",
 "now": 1800000000.0,
 "schema": 1,
 "source": "fixture",
 "title": "One first look over the planted house, a leak and a lock"
}
